{"$id":"capability-index.v0","$schema":"https://json-schema.org/draft/2020-12/schema","additionalProperties":false,"properties":{"authority":{"additionalProperties":false,"properties":{"canAddAuthority":{"const":false},"role":{"const":"derived-discovery-only"},"selfIndexed":{"const":false},"targetEvidenceRemainsAuthority":{"const":true}},"required":["role","canAddAuthority","selfIndexed","targetEvidenceRemainsAuthority"],"type":"object"},"environment":{"additionalProperties":false,"properties":{"generatedAt":{"const":"1970-01-01T00:00:00.000Z"},"host":{"type":"null"}},"required":["generatedAt","host"],"type":"object"},"generatedAt":{"const":"1970-01-01T00:00:00.000Z"},"implementedCapabilities":{"items":{"additionalProperties":false,"properties":{"authorityRole":{"minLength":1,"type":"string"},"canAddAuthority":{"const":false},"capabilityId":{"pattern":"^[a-z0-9][a-z0-9-]*$","type":"string"},"ciGate":{"pattern":"^npm run check:","type":"string"},"demoPaths":{"items":{"pattern":"^[A-Za-z0-9@+_~-][A-Za-z0-9@+._~-]*(?:/[A-Za-z0-9@+_~-][A-Za-z0-9@+._~-]*)*$","type":"string"},"minItems":0,"type":"array","uniqueItems":true},"dependencies":{"additionalProperties":false,"properties":{"compatibility":{"items":{"minLength":1,"type":"string"},"minItems":0,"type":"array","uniqueItems":true},"evidence":{"items":{"minLength":1,"type":"string"},"minItems":0,"type":"array","uniqueItems":true},"phaseGate":{"items":{"minLength":1,"type":"string"},"minItems":0,"type":"array","uniqueItems":true}},"required":["evidence","phaseGate","compatibility"],"type":"object"},"diagnosticSchemaPath":{"pattern":"^[A-Za-z0-9@+_~-][A-Za-z0-9@+._~-]*(?:/[A-Za-z0-9@+_~-][A-Za-z0-9@+._~-]*)*$","type":"string"},"displayName":{"minLength":1,"type":"string"},"documentationRefs":{"items":{"pattern":"^[A-Za-z0-9@+_~-][A-Za-z0-9@+._~-]*(?:/[A-Za-z0-9@+_~-][A-Za-z0-9@+._~-]*)*$","type":"string"},"minItems":1,"type":"array","uniqueItems":true},"evidenceHash":{"pattern":"^[a-f0-9]{64}$","type":"string"},"evidenceHashAlgorithm":{"const":"sha256"},"evidencePath":{"pattern":"^[A-Za-z0-9@+_~-][A-Za-z0-9@+._~-]*(?:/[A-Za-z0-9@+_~-][A-Za-z0-9@+._~-]*)*$","type":"string"},"evidenceRunId":{"minLength":1,"type":"string"},"evidenceSchemaId":{"pattern":"^[a-z0-9][a-z0-9-]*\\.v[0-9]+$","type":"string"},"evidenceStatus":{"const":"pass"},"expectedEvidenceStatus":{"const":"pass"},"expectedPromotionStatus":{"enum":["allowed","review_required","blocked"]},"implementationStatus":{"const":"implemented"},"inputPaths":{"items":{"pattern":"^[A-Za-z0-9@+_~-][A-Za-z0-9@+._~-]*(?:/[A-Za-z0-9@+_~-][A-Za-z0-9@+._~-]*)*$","type":"string"},"minItems":1,"type":"array","uniqueItems":true},"kind":{"const":"proof-target"},"lifecycleRoles":{"items":{"minLength":1,"type":"string"},"minItems":1,"type":"array","uniqueItems":true},"nonCapabilities":{"items":{"minLength":1,"type":"string"},"minItems":1,"type":"array","uniqueItems":true},"outputPaths":{"items":{"pattern":"^[A-Za-z0-9@+_~-][A-Za-z0-9@+._~-]*(?:/[A-Za-z0-9@+_~-][A-Za-z0-9@+._~-]*)*$","type":"string"},"minItems":1,"type":"array","uniqueItems":true},"packageProofScript":{"pattern":"^proof:","type":"string"},"promotionStatus":{"enum":["allowed","review_required","blocked"]},"proofCommand":{"pattern":"^interfacectl surfaces ","type":"string"},"proofMode":{"enum":["synthetic","bounded-local","static","report-only","local-loopback"]},"provenance":{"additionalProperties":false,"properties":{"generatedAt":{"const":"1970-01-01T00:00:00.000Z"},"host":{"type":"null"},"method":{"const":"deterministic-materialization"},"sourceRefs":{"items":{"pattern":"^[A-Za-z0-9@+_~-][A-Za-z0-9@+._~-]*(?:/[A-Za-z0-9@+_~-][A-Za-z0-9@+._~-]*)*$","type":"string"},"minItems":1,"type":"array","uniqueItems":true}},"required":["method","sourceRefs","generatedAt","host"],"type":"object"},"reportPaths":{"items":{"pattern":"^[A-Za-z0-9@+_~-][A-Za-z0-9@+._~-]*(?:/[A-Za-z0-9@+_~-][A-Za-z0-9@+._~-]*)*$","type":"string"},"minItems":0,"type":"array","uniqueItems":true},"roadmapPhase":{"enum":["P0","P1","P2","P3","P4","P5","Target"]},"runtimeEvidencePaths":{"items":{"pattern":"^[A-Za-z0-9@+_~-][A-Za-z0-9@+._~-]*(?:/[A-Za-z0-9@+_~-][A-Za-z0-9@+._~-]*)*$","type":"string"},"minItems":0,"type":"array","uniqueItems":true},"scopeStatement":{"minLength":1,"type":"string"},"userValue":{"minLength":1,"type":"string"}},"required":["capabilityId","displayName","kind","roadmapPhase","implementationStatus","proofMode","userValue","scopeStatement","authorityRole","canAddAuthority","nonCapabilities","lifecycleRoles","proofCommand","packageProofScript","ciGate","evidencePath","evidenceSchemaId","expectedEvidenceStatus","expectedPromotionStatus","inputPaths","outputPaths","diagnosticSchemaPath","reportPaths","demoPaths","runtimeEvidencePaths","documentationRefs","dependencies","provenance","evidenceStatus","promotionStatus","evidenceHashAlgorithm","evidenceHash","evidenceRunId"],"type":"object"},"maxItems":18,"minItems":18,"type":"array"},"plannedCapabilities":{"items":{"additionalProperties":false,"properties":{"authorityRole":{"const":"roadmap-visibility-only"},"canAddAuthority":{"const":false},"capabilityId":{"pattern":"^[a-z0-9][a-z0-9-]*$","type":"string"},"dependencies":{"additionalProperties":false,"properties":{"compatibility":{"items":{"minLength":1,"type":"string"},"minItems":0,"type":"array","uniqueItems":true},"evidence":{"items":{"minLength":1,"type":"string"},"minItems":0,"type":"array","uniqueItems":true},"phaseGate":{"items":{"minLength":1,"type":"string"},"minItems":0,"type":"array","uniqueItems":true}},"required":["evidence","phaseGate","compatibility"],"type":"object"},"displayName":{"minLength":1,"type":"string"},"documentationRefs":{"items":{"pattern":"^[A-Za-z0-9@+_~-][A-Za-z0-9@+._~-]*(?:/[A-Za-z0-9@+_~-][A-Za-z0-9@+._~-]*)*$","type":"string"},"minItems":1,"type":"array","uniqueItems":true},"evidenceStatus":{"const":"not_applicable"},"implementationStatus":{"const":"planned"},"kind":{"const":"planned-group"},"lifecycleRoles":{"items":{"minLength":1,"type":"string"},"minItems":1,"type":"array","uniqueItems":true},"nonCapabilities":{"items":{"minLength":1,"type":"string"},"minItems":1,"type":"array","uniqueItems":true},"promotionStatus":{"const":"not_applicable"},"proofMode":{"const":"planned"},"provenance":{"additionalProperties":false,"properties":{"generatedAt":{"const":"1970-01-01T00:00:00.000Z"},"host":{"type":"null"},"method":{"const":"deterministic-materialization"},"sourceRefs":{"items":{"pattern":"^[A-Za-z0-9@+_~-][A-Za-z0-9@+._~-]*(?:/[A-Za-z0-9@+_~-][A-Za-z0-9@+._~-]*)*$","type":"string"},"minItems":1,"type":"array","uniqueItems":true}},"required":["method","sourceRefs","generatedAt","host"],"type":"object"},"roadmapPhase":{"const":"Horizon"},"scopeStatement":{"minLength":1,"type":"string"},"userValue":{"minLength":1,"type":"string"}},"required":["capabilityId","displayName","kind","roadmapPhase","implementationStatus","proofMode","evidenceStatus","promotionStatus","userValue","scopeStatement","authorityRole","canAddAuthority","nonCapabilities","lifecycleRoles","documentationRefs","dependencies","provenance"],"type":"object"},"maxItems":7,"minItems":7,"type":"array"},"provenance":{"additionalProperties":false,"properties":{"generatedAt":{"const":"1970-01-01T00:00:00.000Z"},"host":{"type":"null"},"method":{"const":"deterministic-materialization"},"sourceRefs":{"items":{"pattern":"^[A-Za-z0-9@+_~-][A-Za-z0-9@+._~-]*(?:/[A-Za-z0-9@+_~-][A-Za-z0-9@+._~-]*)*$","type":"string"},"minItems":1,"type":"array","uniqueItems":true}},"required":["method","sourceRefs","generatedAt","host"],"type":"object"},"schemaId":{"const":"capability-index.v0"},"summary":{"additionalProperties":false,"properties":{"allowedCount":{"minimum":0,"type":"integer"},"blockedCount":{"minimum":0,"type":"integer"},"implementedCount":{"const":18},"passingCount":{"const":18},"plannedCount":{"const":7},"reviewRequiredCount":{"minimum":0,"type":"integer"}},"required":["implementedCount","passingCount","plannedCount","allowedCount","reviewRequiredCount","blockedCount"],"type":"object"},"targetId":{"const":"capability-index"},"version":{"type":"string"}},"required":["schemaId","version","generatedAt","environment","targetId","summary","authority","implementedCapabilities","plannedCapabilities","provenance"],"type":"object"}