{"authority":{"canAddAuthority":false,"role":"derived-discovery-only","selfIndexed":false,"targetEvidenceRemainsAuthority":true},"environment":{"generatedAt":"1970-01-01T00:00:00.000Z","host":null},"generatedAt":"1970-01-01T00:00:00.000Z","implementedCapabilities":[{"authorityRole":"catalog-contract-proof","canAddAuthority":false,"capabilityId":"p0-catalog-contract","ciGate":"npm run check:p0:ci","demoPaths":["demo/p0/index.html"],"dependencies":{"compatibility":[],"evidence":[],"phaseGate":[]},"diagnosticSchemaPath":"schemas/diagnostics.v0.schema.json","displayName":"P0 synthetic catalog contract","documentationRefs":["PLAN.md","VISION.md","plans/runtime-catalog-v0.md"],"evidenceHash":"930058d60dfd9c163b1cb508a79a3ba708865574ef0c61e316f33775cac09b29","evidenceHashAlgorithm":"sha256","evidencePath":"artifacts/p0/evidence.json","evidenceRunId":"p0-a0943a4891ed808120c88ab5168523ba","evidenceSchemaId":"evidence.v0","evidenceStatus":"pass","expectedEvidenceStatus":"pass","expectedPromotionStatus":"review_required","implementationStatus":"implemented","inputPaths":["fixtures/p0"],"kind":"proof-target","lifecycleRoles":["generate-within-bounds","govern-change"],"nonCapabilities":["real design-system ingestion","production rendering"],"outputPaths":["artifacts/p0/adapter-diagnostics.json","artifacts/p0/evidence.json","artifacts/p0/governed-catalog.json"],"packageProofScript":"proof:p0","promotionStatus":"review_required","proofCommand":"interfacectl surfaces proof","proofMode":"synthetic","provenance":{"generatedAt":"1970-01-01T00:00:00.000Z","host":null,"method":"deterministic-materialization","sourceRefs":["PLAN.md","VISION.md","plans/runtime-catalog-v0.md"]},"reportPaths":[],"roadmapPhase":"P0","runtimeEvidencePaths":[],"scopeStatement":"Synthetic source material compiles into a governed catalog with deterministic diagnostics and evidence.","userValue":"Defines the governed generation boundary for Surface IR."},{"authorityRole":"derived-runtime-consumer","canAddAuthority":false,"capabilityId":"p1-web-static","ciGate":"npm run check:p1:ci","demoPaths":["demo/p1/index.html"],"dependencies":{"compatibility":[],"evidence":["p0-catalog-contract"],"phaseGate":[]},"diagnosticSchemaPath":"schemas/runtime-adapter-diagnostics.v0.schema.json","displayName":"P1 web-static runtime projection","documentationRefs":["PLAN.md","VISION.md","plans/p1/README.md"],"evidenceHash":"4a9a3af1a8ff67ced3582ed4065dd702425124f8943ce2085031733b06e00811","evidenceHashAlgorithm":"sha256","evidencePath":"artifacts/p1/evidence.json","evidenceRunId":"p1-cd3fb9598be698d9fcd3727b1fd42266","evidenceSchemaId":"runtime-adapter-evidence.v0","evidenceStatus":"pass","expectedEvidenceStatus":"pass","expectedPromotionStatus":"review_required","implementationStatus":"implemented","inputPaths":["artifacts/p0/governed-catalog.json","fixtures/p1"],"kind":"proof-target","lifecycleRoles":["generate-within-bounds","ship-proven-output"],"nonCapabilities":["general renderer","runtime authority"],"outputPaths":["artifacts/p1/evidence.json","artifacts/p1/runtime-adapter-report.json","artifacts/p1/runtime-projection.json"],"packageProofScript":"proof:p1","promotionStatus":"review_required","proofCommand":"interfacectl surfaces adapter proof","proofMode":"static","provenance":{"generatedAt":"1970-01-01T00:00:00.000Z","host":null,"method":"deterministic-materialization","sourceRefs":["PLAN.md","VISION.md","plans/p1/README.md"]},"reportPaths":["artifacts/p1/runtime-adapter-report.json"],"roadmapPhase":"P1","runtimeEvidencePaths":[],"scopeStatement":"A web-static projection and render plans are derived from accepted P0 catalog evidence without becoming authority.","userValue":"Projects governed catalog records into inert runtime-facing plans."},{"authorityRole":"declared-source-ingestion-proof","canAddAuthority":false,"capabilityId":"p2-spectrum-ingestion","ciGate":"npm run check:p2:ci","demoPaths":["demo/p2/index.html"],"dependencies":{"compatibility":[],"evidence":[],"phaseGate":["p1-web-static"]},"diagnosticSchemaPath":"schemas/design-system-ingestion-diagnostics.v0.schema.json","displayName":"P2 bounded Spectrum ingestion","documentationRefs":["PLAN.md","VISION.md","plans/p2/README.md"],"evidenceHash":"fec0c873117cfa74249fba4872a9635540852ee93a3fa8f5e0815339417aaed3","evidenceHashAlgorithm":"sha256","evidencePath":"artifacts/p2/evidence.json","evidenceRunId":"p2-12566c6953235e12cb73bbd83bffb70f","evidenceSchemaId":"design-system-ingestion-evidence.v0","evidenceStatus":"pass","expectedEvidenceStatus":"pass","expectedPromotionStatus":"review_required","implementationStatus":"implemented","inputPaths":["fixtures/p2","sources/p2/design-system-source"],"kind":"proof-target","lifecycleRoles":["connect-authority","govern-change"],"nonCapabilities":["full Spectrum support","live source APIs"],"outputPaths":["artifacts/p2/evidence.json","artifacts/p2/governed-catalog.json","artifacts/p2/ingestion-report.json"],"packageProofScript":"proof:p2","promotionStatus":"review_required","proofCommand":"interfacectl surfaces ingest proof","proofMode":"bounded-local","provenance":{"generatedAt":"1970-01-01T00:00:00.000Z","host":null,"method":"deterministic-materialization","sourceRefs":["PLAN.md","VISION.md","plans/p2/README.md"]},"reportPaths":["artifacts/p2/ingestion-report.json"],"roadmapPhase":"P2","runtimeEvidencePaths":[],"scopeStatement":"Ingests the locked Adobe Spectrum Design Data package only for button and in-line-alert from a manifest-declared local bundle.","userValue":"Compiles a bounded real design-system source into governed catalog records with source refs."},{"authorityRole":"inert-orchestration-consumer","canAddAuthority":false,"capabilityId":"p3-agent-orchestration","ciGate":"npm run check:p3:ci","demoPaths":["demo/p3/index.html"],"dependencies":{"compatibility":[],"evidence":["p2-spectrum-ingestion"],"phaseGate":[]},"diagnosticSchemaPath":"schemas/agent-orchestration-diagnostics.v0.schema.json","displayName":"P3 inert agent orchestration","documentationRefs":["PLAN.md","VISION.md","plans/p3/README.md"],"evidenceHash":"794899bcc75716bb859588f86f5fc813860146a4c300cc64e07469f7d76ed704","evidenceHashAlgorithm":"sha256","evidencePath":"artifacts/p3/evidence.json","evidenceRunId":"p3-8aac92f24249056fd3e98976fdbde5fe","evidenceSchemaId":"agent-orchestration-evidence.v0","evidenceStatus":"pass","expectedEvidenceStatus":"pass","expectedPromotionStatus":"review_required","implementationStatus":"implemented","inputPaths":["artifacts/p2/evidence.json","artifacts/p2/governed-catalog.json","fixtures/p3"],"kind":"proof-target","lifecycleRoles":["generate-within-bounds","review-with-confidence"],"nonCapabilities":["live agents","tool or connector execution"],"outputPaths":["artifacts/p3/agent-orchestration-report.json","artifacts/p3/evidence.json","artifacts/p3/review-queue.json"],"packageProofScript":"proof:p3","promotionStatus":"review_required","proofCommand":"interfacectl surfaces agents proof","proofMode":"static","provenance":{"generatedAt":"1970-01-01T00:00:00.000Z","host":null,"method":"deterministic-materialization","sourceRefs":["PLAN.md","VISION.md","plans/p3/README.md"]},"reportPaths":["artifacts/p3/agent-orchestration-report.json"],"roadmapPhase":"P3","runtimeEvidencePaths":[],"scopeStatement":"Produces an inert registry, task DAG, work orders, review queue, report, and evidence from accepted P2 evidence.","userValue":"Describes bounded agent work without authorizing execution."},{"authorityRole":"review-and-evaluation-consumer","canAddAuthority":false,"capabilityId":"p4-review-judgment","ciGate":"npm run check:p4:ci","demoPaths":["demo/p4/index.html"],"dependencies":{"compatibility":[],"evidence":["p3-agent-orchestration"],"phaseGate":[]},"diagnosticSchemaPath":"schemas/review-judgment-diagnostics.v0.schema.json","displayName":"P4 deterministic review and judgment","documentationRefs":["PLAN.md","VISION.md","plans/p4/README.md"],"evidenceHash":"553ed16729bd0fd3ee7bb385364f1d82b756f236393a85e98f9aa05fdea3201d","evidenceHashAlgorithm":"sha256","evidencePath":"artifacts/p4/evidence.json","evidenceRunId":"p4-227b52e7a0f35991f80a114177bee6b9","evidenceSchemaId":"review-judgment-evidence.v0","evidenceStatus":"pass","expectedEvidenceStatus":"pass","expectedPromotionStatus":"blocked","implementationStatus":"implemented","inputPaths":["artifacts/p3/evidence.json","artifacts/p3/review-queue.json","fixtures/p4"],"kind":"proof-target","lifecycleRoles":["review-with-confidence","govern-change"],"nonCapabilities":["live SurfaceOps","live JudgmentKit"],"outputPaths":["artifacts/p4/evidence.json","artifacts/p4/judgmentkit-evaluation-report.json","artifacts/p4/review-judgment-report.json"],"packageProofScript":"proof:p4","promotionStatus":"blocked","proofCommand":"interfacectl surfaces review proof","proofMode":"report-only","provenance":{"generatedAt":"1970-01-01T00:00:00.000Z","host":null,"method":"deterministic-materialization","sourceRefs":["PLAN.md","VISION.md","plans/p4/README.md"]},"reportPaths":["artifacts/p4/judgmentkit-evaluation-report.json","artifacts/p4/review-judgment-report.json"],"roadmapPhase":"P4","runtimeEvidencePaths":[],"scopeStatement":"Produces SurfaceOps-shaped decisions and JudgmentKit-shaped findings without live persistence or invocation.","userValue":"Preserves review decisions and evaluation findings as deterministic evidence."},{"authorityRole":"derived-protocol-consumer","canAddAuthority":false,"capabilityId":"p5-protocol-static","ciGate":"npm run check:p5:protocol:ci","demoPaths":["demo/p5/protocol/index.html"],"dependencies":{"compatibility":[],"evidence":["p2-spectrum-ingestion","p4-review-judgment"],"phaseGate":[]},"diagnosticSchemaPath":"schemas/protocol-adapter-diagnostics.v0.schema.json","displayName":"P5 surfaces-protocol-static","documentationRefs":["PLAN.md","VISION.md","plans/p5/README.md"],"evidenceHash":"fb289c3aadd98d4c892d77016ca300fba8df7da35d835cecd4937929747be106","evidenceHashAlgorithm":"sha256","evidencePath":"artifacts/p5/protocol/evid